Data source,,,,,,,,,,,,,,,
sinton1997,,,,,,,,,,walter1990,"Walter, R. The Southern Cook Islands in Eastern Polynesian prehistory. (University of Auckland, 1990).",,walter1990,"Walter, R. The Southern Cook Islands in Eastern Polynesian prehistory. (University of Auckland, 1990).",
sinton1997,,,,,,,,,,walter1998,"Walter, R. Anai’o: The Archaeology of a Fourteenth Century Polynesian Community in the Cook Islands. (New Zealand Archaeological Association, 1998).",,walter1998,"Walter, R. Anai’o: The Archaeology of a Fourteenth Century Polynesian Community in the Cook Islands. (New Zealand Archaeological Association, 1998).",
sinton1997,,,,,,,,,,weisler1994a,"Weisler, M. I., Kirch, P. V. & Endicott, J. M. The Mata’are basalt source: Implications for prehistoric interaction studies in the Cook Islands. Journal of the Polynesian Society 103, 203–216 (1994).",,weisler1994a,"Weisler, M. I., Kirch, P. V. & Endicott, J. M. The Mata’are basalt source: Implications for prehistoric interaction studies in the Cook Islands. Journal of the Polynesian Society 103, 203–216 (1994).",
sinton1997,,,,,,,,,,,,,mccoy1977,"McCoy, P. C. The Mauna Kea Adze Quarry Project: A Summary of the 1975 Field Investigations. Journal of the Polynesian Society 86, 223–244 (1977).",
sinton1997,,,,,,,,,,,,,cleghorn1985,"Cleghorn, P. L., Weisler, M., Dye, T. & Sinton, J. A preliminary petrographic study of Hawaiian stone adze quarries. Journal of the Polynesian Society 94, 235–251 (1985).",
sinton1997,,,,,,,,,,,,,tuggle1980,"Tuggle, H. D. & Tomonari-Tuggle, M. J. Prehistoric Agriculture in Kohala, Hawaii. Journal of Field Archaeology 7, 297–312 (1980).",
sinton1997,,,,,,,,,,,,,field2008,"Field, M. G. J. S. & Graves, M. W. A New Chronology for Pololu Valley, Hawai’i Island: Occupational History and Agricultural Development. Radiocarbon 50, 205–222 (2008).",
sinton1997,,,,,,,,,,,,,mccoy1993,"Mc Coy, P., Makanani, A. & Sinoto, A. Archaeological investigations of the Pu’u Moiwi adze quarry complex, Kaho’olawe. 204 (Kaho’olawe Island Conveyance Commission, 1993).",
sinton1997,,,,,,,,,,,,,mintmier2012,"Mintmier, M. A., Mills, P. R. & Lundblad, S. P. Energy-Dispersive X-Ray Fluorescence analysis of Haleakalā basalt adze quarry materials, Maui, Hawai'i. Journal of Archaeological Science 39, 615–623 (2012).",
sinton1997,,,,,,,,,,,,,collerson2007,"Collerson, K. D. & Weisler, M. I. Stone Adze Compositions and the Extent of Ancient Polynesian Voyaging and Trade. Science 317, 1907–1911 (2007).",
sinton1997,,,,,,,,,,,,,weisler2011,"Weisler, M. A quarried landscape in the Hawaiian Islands. World Archaeology 43, 298–317 (2011).",
sinton1997,,,,,,,,,,,,,weisler1993,"Weisler, M. I. Long-distance Interaction in Prehistoric Polynesia: Three Case Studies. (1993).",
sinton1997,,,,,,,,,,,,,weisler1994,"Weisler, M. I. The Settlement of Marginal Polynesia: New Evidence from Henderson Island. Journal of Field Archaeology 21, 83–102 (1994).",
sinton1997,,,,,,,,,,,,,sinoto1983,"Sinoto, Y. H. An analysis of Polynesian migrations based on the archaeological assessments. Journal de la Société des océanistes 39, 57–67 (1983).",
sinton1997,,,,,,,,,,,,,suggs1961,"Suggs, R. C. The Archaeology of Nuku Hiva, Marquesas Islands, French Polynesia. (1961).",
sinton1997,,,,,,,,,,,,,rolett1995,"Rolett, B. V. & Conte, E. Renewed investigation of the Ha’atuatua dune ( Nukuhiva, Marquesas Islands): A key site in Polynesian prehistory. Journal of the Polynesian Society 104, 195–228 (1995).",
sinton1997,,,,,,,,,,,,,ottino1985,"Ottino, P. Un site ancien aux îles Marquises : l’abri-sous-roche d’Anapua, à Ua Pou. Journal de la Société des Océanistes 41, 33–37 (1985).",
sinton1997,,,,,,,,,,,,,anderson1999,"Anderson, A., Clark, G., Conte, É., Sinoto, Y. H. & Petchey, F. Renewed Excavations at Motu Paeao, Maupiti Island, French Polynesia: Preliminary Results. New Zealand Journal of Archaeology 21, 47–66 (2000).",
felgate2001,WD-XRF analyses of the Tahanga basalt quarry and comparison of compositions with other potential procurement sources of similar material in the north Island of New Zealand,"Analysis of geochemical compositions for 30 samples collected at the Tahanga quarry (Coromandel peninsula, NZ) and in several other locations in the North Island (Great Barrier Is., Houhora, Te Henga beach, Waitakere river)","Felgate, Matthew (1), Sheppard, Peter (1), Wilmshurst, Janet (2)","1. University of Auckland, Anthropology Dept (NZ); 2. University of Auckland, Geology Dept (NZ)","Hermann, Aymeric",aymeric.hermann@cnrs.fr,felgate2001,"Felgate, M. W., Sheppard, P. J. & Wilmshurst, J. M. Geochemical characteristics of the Tahanga archaeological quarry complex. Archaeology in New Zealand 44, 215–240 (2001).",,felgate2001,"Felgate, M. W., Sheppard, P. J. & Wilmshurst, J. M. Geochemical characteristics of the Tahanga archaeological quarry complex. Archaeology in New Zealand 44, 215–240 (2001).",,felgate2001,"Felgate, M. W., Sheppard, P. J. & Wilmshurst, J. M. Geochemical characteristics of the Tahanga archaeological quarry complex. Archaeology in New Zealand 44, 215–240 (2001).",
ayres1997,Sourcing of material used for the construction of monumental architecture and artefacts from Pohnpei (Caroline Islands).,"Instrumental Neutron Activation Analysis (INAA) of Nan Mandol monumental architecture and artefacts from Pohnpei (Ponape) in the Caroline Islands, compared with local boulders and columnar basalt material.","Ayres, W. S., Goles, G. G. & Beardsley, F. R.",University of Oregon (USA),"Hermann, Aymeric",aymeric.hermann@cnrs.fr,ayres1997,"Ayres, W. S., Goles, G. G. & Beardsley, F. R. Provenance study of lithic materials in Micronesia. in Prehistoric long-distance interaction in Oceania: an interdisciplinary approach (ed. Weisler, M. I.) 53–67 (New Zealand Archaeological Association, 1997).",,ayres1997,"Ayres, W. S., Goles, G. G. & Beardsley, F. R. Provenance study of lithic materials in Micronesia. in Prehistoric long-distance interaction in Oceania: an interdisciplinary approach (ed. Weisler, M. I.) 53–67 (New Zealand Archaeological Association, 1997).",,ayres1997,"Ayres, W. S., Goles, G. G. & Beardsley, F. R. Provenance study of lithic materials in Micronesia. in Prehistoric long-distance interaction in Oceania: an interdisciplinary approach (ed. Weisler, M. I.) 53–67 (New Zealand Archaeological Association, 1997).",
ayres1997,,,,,,,,,,ayres1987,"Ayres, W. S. & Mauricio, R. Stone Adzes from Pohnpeian, Micronesia. Archaeology in Oceania 22, 27–31 (1987).",,ayres1987,"Ayres, W. S. & Mauricio, R. Stone Adzes from Pohnpeian, Micronesia. Archaeology in Oceania 22, 27–31 (1987).",
ayres1997,,,,,,,,,,,,,leach1987,"Leach, H. & Witter, D. Tataga-Matau “rediscovered”. New Zealand Journal of Archaeology 9, 33–54 (1987).",
ayres1997,,,,,,,,,,,,,johnson2013,"Johnson, P. R. Elemental Analysis of Fine-Grained Basalt Sources from the Samoan Island of Tutuila: Applications of Energy Dispersive X-Ray Fluorescence (EDXRF) and Instrumental Neutron Activation Analysis (INAA) Toward an Intra-Island Provenance Study. in X-Ray Fluorescence Spectrometry (XRF) in Geoarchaeology (ed. Shackley, M. S.) 143–160 (Springer New York, 2011). doi:10.1007/978-1-4419-6886-9_7",https://doi.org/10.1007/978-1-4419-6886-9_7
ayres1997,,,,,,,,,,,,,collerson2007,"Collerson, K. D. & Weisler, M. I. Stone Adze Compositions and the Extent of Ancient Polynesian Voyaging and Trade. Science 317, 1907–1911 (2007).",https://doi.org/10.1126/science.1147013
ayres1997,,,,,,,,,,,,,ayres2001,"Ayres, W. S., Wozniak, J. A., Robbins, G. & Suafo’a, E. Archaeology in American Samoa: Maloata, Malaeimi and Malaeloa. in Pacific 2000: Proceedings of the Fifth International Conference on Easter Island and the Pacific (eds. Stevenson, C. M., Lee, G. & Morin, F. J.) 227–235 (2001).",
ayres1997,,,,,,,,,,,,,winterhoff2007a,"Winterhoff, E. Q., Wozniak, J. A., Ayres, W. S. & Lash, E. Intra-Island Source Variability on Tutuila, American Samoa and Prehistoric Basalt Adze Exchange in Western Polynesia-Island Melanesia. Archaeology in Oceania 42, 65–71 (2007).",
mccoy2016,"Sourcing of material used for the construction of monumental architecture of Nan Mandol, Pohnpei (Caroline Islands).",Portable ED-XRF analyses of mid-z elements for  boulders and columnar basalt from geological formations and from Nan Mandol.,"Mark D. McCoy (a), Helen A. Alderson (b), Richard Hemi (c), Hai Cheng (d, e), R. Lawrence Edwards (e)","a Southern Methodist University, USA
b University of Cambridge, UK
c University of Otago, New Zealand
d Institute of Global Environmental Change, China 
e University of Minnesota, USA","Hermann, Aymeric",aymeric.hermann@cnrs.fr,mccoy2016,"McCoy, M. D., Alderson, H. A., Hemi, R., Cheng, H. & Edwards, R. L. Earliest direct evidence of monument building at the archaeological site of Nan Madol (Pohnpei, Micronesia) identified using 230Th/U coral dating and geochemical sourcing of megalithic architectural stone. Quaternary Research 86, 295–303 (2016).",10.1016/j.yqres.2016.08.002,mccoy2016,"McCoy, M. D., Alderson, H. A., Hemi, R., Cheng, H. & Edwards, R. L. Earliest direct evidence of monument building at the archaeological site of Nan Madol (Pohnpei, Micronesia) identified using 230Th/U coral dating and geochemical sourcing of megalithic architectural stone. Quaternary Research 86, 295–303 (2016).",10.1016/j.yqres.2016.08.002,mccoy2016,"McCoy, M. D., Alderson, H. A., Hemi, R., Cheng, H. & Edwards, R. L. Earliest direct evidence of monument building at the archaeological site of Nan Madol (Pohnpei, Micronesia) identified using 230Th/U coral dating and geochemical sourcing of megalithic architectural stone. Quaternary Research 86, 295–303 (2016).",10.1016/j.yqres.2016.08.002
mccoy2016,,,,,,,,,,mccoy2011a,"McCoy, M. D. & Athens, J. S. Sourcing the Megalithic Stones of Nan Madol: an XRF Study of Architectural Basalt Stone from Pohnpei, Federated States of Micronesia. JPA 3, (2011).",,mccoy2015,"McCoy, M. D., Alderson, H. A. & Thompson, A. A new archaeological field survey of the site of Nan Madol, Pohnpei. Rapa Nui Journal 29, 5–22 (2015).",
hermann2019,Sourcing of material from surface contexts on Teti'aroa atoll (Society islands).,"Combined portable ED-XRF and destructive ICP-AES analyses of major and trace elements. Beyond documenting regional patterns, the study also highlights the presence of andesite material 2 500 km beyond the Andesite Line.","Hermann, A. (1,2), Molle, G. (3), Maury, R. (4), Liorzou, C. (4), McAlister, A. (5)","(1) Max Planck Institute for the Science of Human History; (2)UMR 7041, CNRS; (3) Australian National University; (4) Université de Bretagne Occidentale; (5) University of Auckland","Hermann, Aymeric",aymeric.hermann@cnrs.fr,hermann2019,"Hermann, A., Molle, G., Maury, R., Liorzou, C. & McAlister, A. Geochemical sourcing of volcanic materials imported into Teti’aroa Atoll shows multiple long-distance interactions in the Windward Society Islands, French Polynesia. Archaeology in Oceania (2019).",10.1002/arco.5187,hermann2019,"Hermann, A., Molle, G., Maury, R., Liorzou, C. & McAlister, A. Geochemical sourcing of volcanic materials imported into Teti’aroa Atoll shows multiple long-distance interactions in the Windward Society Islands, French Polynesia. Archaeology in Oceania (2019).",10.1002/arco.5187,hermann2019,"Hermann, A., Molle, G., Maury, R., Liorzou, C. & McAlister, A. Geochemical sourcing of volcanic materials imported into Teti’aroa Atoll shows multiple long-distance interactions in the Windward Society Islands, French Polynesia. Archaeology in Oceania (2019).",10.1002/arco.5187
hermann2019,,,,,,,,,,molle2017,"Molle, G. & Hermann, A. An Atoll in History: Archaeological Research on Teti’aroa (Society Islands). Final Report Phase 1. (Teti’aroa Society, Seeley Foundation, 2016).",,molle2017,"Molle, G. & Hermann, A. An Atoll in History: Archaeological Research on Teti’aroa (Society Islands). Final Report Phase 1. (Teti’aroa Society, Seeley Foundation, 2016).",
reepmeyer2010,"Sourcing of artefacts from Lakeba, Lau Islands.","Trace element and isotope compositions are used to source artefacts Best 1984 collection. Flaked artefacts, obsidian raw material.","Reepmeyer, C.
Clark, G.","Australian National University, Canberra","Reepmeyer, Christian",christian.reepmeyer@jcu.edu.au,reepmeyer2010,"Reepmeyer, C. & Clark, G. Post-Colonization Interaction Between Vanuatu and Fiji Reconsidered: The Re-Analysis of Obsidian from Lakeba Island, Fiji. Archaeometry 52, 1–18 (2010).",10.1111/j.1475-4754.2009.00465.x,best1984,"Best, S. B. Lakeba: The prehistory of a Fijian island. (University of Auckland, 1984).",,best1984,"Best, S. B. Lakeba: The prehistory of a Fijian island. (University of Auckland, 1984).",
reepmeyer2010,,,,,,,,,,reepmeyer2010,"Reepmeyer, C. & Clark, G. Post-Colonization Interaction Between Vanuatu and Fiji Reconsidered: The Re-Analysis of Obsidian from Lakeba Island, Fiji. Archaeometry 52, 1–18 (2010).",10.1111/j.1475-4754.2009.00465.x,reepmeyer2010,"Reepmeyer, C. & Clark, G. Post-Colonization Interaction Between Vanuatu and Fiji Reconsidered: The Re-Analysis of Obsidian from Lakeba Island, Fiji. Archaeometry 52, 1–18 (2010).",10.1111/j.1475-4754.2009.00465.x
mccoy2019,Geochemical Sourcing of New Zealand Obsidians by Portable X-Ray Florescence from 2011 to 2018,"This dataset is based on a study of 4,582 obsidian artefacts matched to their natural geological source from 45 archaeological sites in New Zealand (Aotearoa). It is a compilation of a number of independent projects conducted in the laboratories of the University of Auckland and University of Otago from 2011 to 2018.","Mark D. McCoy (1), Alex Jorgensen (2), Hayley Glover (2), Christopher Stevenson (3), Brendan Kneebone (2), Arden Cruickshank (4), Andrew McAlister (2), Isaac McIvor (5),
Caleb Gemmell (6,7), Dion O. O’Neale (6,7), Thegn N. Ladefoged (2,7)","1. Department of Anthropology, Southern Methodist University, Dallas, Texas, US; 2. Anthropology, School of Social Sciences, University of Auckland, NZ; 3. Anthropology Program, Virginia Commonwealth University, US; 4. CFG Heritage Ltd, Auckland, NZ; 5. Heritage New Zealand Pouhere Taonga, Auckland, NZ; 6. Department of Physics, University of Auckland, NZ; 7. Te Pūnaha Matatini, a New Zealand Centre of Research Excellence, NZ","McCoy, Mark D.",mdmccoy@smu.edu,lawrence2014,"Lawrence, M., McCoy, M. D., Barber, I. & Walter, R. Geochemical sourcing of obsidians from the Pūrākaunui site, South Island, New Zealand. Archaeology in Oceania 49, 158–163 (2014).",10.1002/arco.5032,anderson1981,"Anderson, A. J. A fourteenth-century fishing camp at Purakanui Inlet, Otago. Journal of the Royal Society of New Zealand 11, 201–221 (1981).",10.1080/03036758.1981.10421837,anderson1981,"Anderson, A. J. A fourteenth-century fishing camp at Purakanui Inlet, Otago. Journal of the Royal Society of New Zealand 11, 201–221 (1981).",10.1080/03036758.1981.10421837
mccoy2019,,,,,,,lawrence2014,"Lawrence, M., McCoy, M. D., Barber, I. & Walter, R. Geochemical sourcing of obsidians from the Pūrākaunui site, South Island, New Zealand. Archaeology in Oceania 49, 158–163 (2014).",10.1002/arco.5032,gay2004,"Gay, J. W. Selected Artefact Assemblages from Purakaunui (144/21) Excavated during 2001, 2002 and 2003. (University of Otago, 2004).",,barber2002,"Barber, I. G. Archaeological assessment of an eroding site complex No I44-21 at Purakaunui Inlet, Otago. Archaeology in New Zealand 45, 153–170 (2002).",
mccoy2019,,,,,,,mccoy2014a,"McCoy, M. D. & Carpenter, J. Strategies for Obtaining Obsidian in Pre-European Contact Era New Zealand. PLoS One 9, (2014).",10.1371/journal.pone.0084302,carpenter2010,"Carpenter, J. Archaeological Monitoring of Archaeological Site Q06/567. Preliminary Report. Unpublished report for the Whangarei District Council. (Geometria Ltd, 2010).",,carpenter2010,"Carpenter, J. Archaeological Monitoring of Archaeological Site Q06/567. Preliminary Report. Unpublished report for the Whangarei District Council. (Geometria Ltd, 2010).",
mccoy2019,,,,,,,mccoy2014a,"McCoy, M. D. & Carpenter, J. Strategies for Obtaining Obsidian in Pre-European Contact Era New Zealand. PLoS One 9, (2014).",10.1371/journal.pone.0084302,davidson2011,"Davidson, J. Archaeological investigations at Maungarei: A large Mäori settlement on a volcanic cone in Auckland, New Zealand. Tuhinga, Records of the Museum of New Zealand Te Papa Tongarewa 22, 19–100 (2011).",,davidson2011,"Davidson, J. Archaeological investigations at Maungarei: A large Mäori settlement on a volcanic cone in Auckland, New Zealand. Tuhinga, Records of the Museum of New Zealand Te Papa Tongarewa 22, 19–100 (2011).",
mccoy2019,,,,,,,mccoy2014a,"McCoy, M. D. & Carpenter, J. Strategies for Obtaining Obsidian in Pre-European Contact Era New Zealand. PLoS One 9, (2014).",10.1371/journal.pone.0084302,carpenter2009,"Carpenter, J. Smugglers and Bream Head Track Upgrade. Preliminary Report for HPT Authority 2007/97. Unpublished report for the Department of Conservation. (Geometria Ltd, 2009).",,carpenter2009,"Carpenter, J. Smugglers and Bream Head Track Upgrade. Preliminary Report for HPT Authority 2007/97. Unpublished report for the Department of Conservation. (Geometria Ltd, 2009).",
mccoy2019,,,,,,,mccoy2014,"McCoy, M. D., Ladefoged, T. N., Codlin, M. & Sutton, D. G. Does Carneiro’s circumscription theory help us understand Maori history? An analysis of the obsidian assemblage from Pouerua Pa, New Zealand (Aotearoa). Journal of Archaeological Science 42, 467–475 (2014).",10.1016/j.jas.2013.11.034,mccoy2014,"McCoy, M. D., Ladefoged, T. N., Codlin, M. & Sutton, D. G. Does Carneiro’s circumscription theory help us understand Maori history? An analysis of the obsidian assemblage from Pouerua Pa, New Zealand (Aotearoa). Journal of Archaeological Science 42, 467–475 (2014).",10.1016/j.jas.2013.11.034,mccoy2014,"McCoy, M. D., Ladefoged, T. N., Codlin, M. & Sutton, D. G. Does Carneiro’s circumscription theory help us understand Maori history? An analysis of the obsidian assemblage from Pouerua Pa, New Zealand (Aotearoa). Journal of Archaeological Science 42, 467–475 (2014).",10.1016/j.jas.2013.11.034
mccoy2019,,,,,,,mccoy2014,"McCoy, M. D., Ladefoged, T. N., Codlin, M. & Sutton, D. G. Does Carneiro’s circumscription theory help us understand Maori history? An analysis of the obsidian assemblage from Pouerua Pa, New Zealand (Aotearoa). Journal of Archaeological Science 42, 467–475 (2014).",10.1016/j.jas.2013.11.034,brassey1985,"Brassey, R. An analysis of some lithic artefact assemblages from Pouerua, Northland. (University of Auckland, 1985).",,sutton2003,"Sutton, D., Furey, L. & Marshall, Y. The Archaeology of Pouerua. (Auckland University Press, 2003).",
mccoy2019,,,,,,,walter2018,"Walter, R., Brooks, E., Greig, K. & Hurford, J. Excavations at Kahukura, Murihiku. Journal of Pacific Archaeology 9, 59–82 (2018).",,walter2018,"Walter, R., Brooks, E., Greig, K. & Hurford, J. Excavations at Kahukura, Murihiku. Journal of Pacific Archaeology 9, 59–82 (2018).",,walter2018,"Walter, R., Brooks, E., Greig, K. & Hurford, J. Excavations at Kahukura, Murihiku. Journal of Pacific Archaeology 9, 59–82 (2018).",
mccoy2019,,,,,,,walter2018,"Walter, R., Brooks, E., Greig, K. & Hurford, J. Excavations at Kahukura, Murihiku. Journal of Pacific Archaeology 9, 59–82 (2018).",,,,,brooks2008,"Brooks, E., Walter, R. & Jacomb, C. Southland Coastal Heritage Inventory Project Waiparua Head to Rowallan Burn. (Southern Pacific Archaeological Research, 2008).",
mccoy2019,,,,,,,mccoy2016a,"McCoy, M. D. & Robles, H. N. The Geographic Range of Interaction Spheres During the Colonization of New Zealand (Aotearoa): New Evidence for Obsidian Circulation in Southern New Zealand. The Journal of Island and Coastal Archaeology 11, 285–293 (2016).",https://doi.org/10.1080/15564894.2015.1115788,mccoy2016a,"McCoy, M. D. & Robles, H. N. The Geographic Range of Interaction Spheres During the Colonization of New Zealand (Aotearoa): New Evidence for Obsidian Circulation in Southern New Zealand. The Journal of Island and Coastal Archaeology 11, 285–293 (2016).",https://doi.org/10.1080/15564894.2015.1115788,davidson1984,"Davidson, J. The Prehistory of New Zealand. (Longman Paul, 1984).",
mccoy2019,,,,,,,mccoy2016a,"McCoy, M. D. & Robles, H. N. The Geographic Range of Interaction Spheres During the Colonization of New Zealand (Aotearoa): New Evidence for Obsidian Circulation in Southern New Zealand. The Journal of Island and Coastal Archaeology 11, 285–293 (2016).",https://doi.org/10.1080/15564894.2015.1115788,,,,hamel2001,"Hamel, J. The archaeology of Otago. (Department of Conservation, 2001).",
mccoy2019,,,,,,,mccoy2016a,"McCoy, M. D. & Robles, H. N. The Geographic Range of Interaction Spheres During the Colonization of New Zealand (Aotearoa): New Evidence for Obsidian Circulation in Southern New Zealand. The Journal of Island and Coastal Archaeology 11, 285–293 (2016).",https://doi.org/10.1080/15564894.2015.1115788,,,,smith1993,"Smith, I. Preliminary Report on Excavations at Pleasant River Mouth (J43/1). (N.Z. Historic Places Trust, 1993).",
mccoy2019,,,,,,,mccoy2016a,"McCoy, M. D. & Robles, H. N. The Geographic Range of Interaction Spheres During the Colonization of New Zealand (Aotearoa): New Evidence for Obsidian Circulation in Southern New Zealand. The Journal of Island and Coastal Archaeology 11, 285–293 (2016).",https://doi.org/10.1080/15564894.2015.1115788,,,,anderson1996,"Anderson, A., Smith, I. W. G. & Allingham, B. Shag River mouth : the archaeology of an early southern Maori village. (Australian National University, 1996).",
mccoy2019,,,,,,,mccoy2016a,"McCoy, M. D. & Robles, H. N. The Geographic Range of Interaction Spheres During the Colonization of New Zealand (Aotearoa): New Evidence for Obsidian Circulation in Southern New Zealand. The Journal of Island and Coastal Archaeology 11, 285–293 (2016).",https://doi.org/10.1080/15564894.2015.1115788,,,,skinner1960,"Skinner, H. D. Excavations at Little Papanui, Otago Peninsula. Journal of the Polynesian Society 69, 187–198 (1960).",
mccoy2019,,,,,,,mccoy2016a,"McCoy, M. D. & Robles, H. N. The Geographic Range of Interaction Spheres During the Colonization of New Zealand (Aotearoa): New Evidence for Obsidian Circulation in Southern New Zealand. The Journal of Island and Coastal Archaeology 11, 285–293 (2016).",https://doi.org/10.1080/15564894.2015.1115788,,,,leach1981a,"Leach, H. & Hamel, J. Archaic and Classic Maori Relationships at Long Beach, Otago: the Artefacts and Activity Areas. New Zealand Journal of Archaeology 3, 109–141 (1981).",
mccoy2019,,,,,,,mccoy2016a,"McCoy, M. D. & Robles, H. N. The Geographic Range of Interaction Spheres During the Colonization of New Zealand (Aotearoa): New Evidence for Obsidian Circulation in Southern New Zealand. The Journal of Island and Coastal Archaeology 11, 285–293 (2016).",https://doi.org/10.1080/15564894.2015.1115788,,,,garland2019,"Garland, J. & Wadsworth, T. An Archaeological Survey of Catlins Lake and Estuary, Southland. Archaeology in New Zealand 27–38 (2019).",
mccoy2019,,,,,,,mccoy2016a,"McCoy, M. D. & Robles, H. N. The Geographic Range of Interaction Spheres During the Colonization of New Zealand (Aotearoa): New Evidence for Obsidian Circulation in Southern New Zealand. The Journal of Island and Coastal Archaeology 11, 285–293 (2016).",https://doi.org/10.1080/15564894.2015.1115788,,,,teviotdale1932,"Teviotdale, D. The material culture of the Moa-Hunters in Murihiku. Journal of the Polynesian Society 41, 81–120 (1932).",
mccoy2019,,,,,,,maxwell2017,"Maxwell, J. J., McCoy, M. D., Tromp, M., Hoffmann, A. & Barber, I. G. The Difficult Place of Deserted Coasts in Archaeology: New Archaeological Research on Cooks Beach (Pukaki), Coromandel Peninsula, New Zealand. The Journal of Island and Coastal Archaeology 13, 1–20 (2017).",http://dx.doi.org/10.1080/15564894.2017.1285833,,,,maxwell2017,"Maxwell, J. J., McCoy, M. D., Tromp, M., Hoffmann, A. & Barber, I. G. The Difficult Place of Deserted Coasts in Archaeology: New Archaeological Research on Cooks Beach (Pukaki), Coromandel Peninsula, New Zealand. The Journal of Island and Coastal Archaeology 13, 1–20 (2017).",http://dx.doi.org/10.1080/15564894.2017.1285833
mccoy2019,,,,,,,maxwell2017,"Maxwell, J. J., McCoy, M. D., Tromp, M., Hoffmann, A. & Barber, I. G. The Difficult Place of Deserted Coasts in Archaeology: New Archaeological Research on Cooks Beach (Pukaki), Coromandel Peninsula, New Zealand. The Journal of Island and Coastal Archaeology 13, 1–20 (2017).",http://dx.doi.org/10.1080/15564894.2017.1285833,,,,hoffmann2017,"Hoffmann, A. Investigation of archaeological site T11/2789, Cooks Beach (Pukaki), Mercury Bay: final report. HNZ authorities 2015/867 & 2015/1022. (2017).",
cruickshank2011,Obsidian Sources on Aotea (Great Barrier) Island and its distribution within the Tamaki region,This thesis presents obsidian sources on Aotea/Great Barrier Island and the content of six prehistoric sites in the Tamaki Region.,"Cruickshank, Arden",University of Auckland (New Zealand),"Hermann, Aymeric",aymeric.hermann@cnrs.fr,cruickshank2011,"Cruickshank, A. A Qualitative and Quantitative Analysis of the Obsidian Sources on Aotea (Great Barrier Island), and their Archaeological Significance. (2011).",,cruickshank2011,"Cruickshank, A. A Qualitative and Quantitative Analysis of the Obsidian Sources on Aotea (Great Barrier Island), and their Archaeological Significance. (2011).",,cruickshank2011,"Cruickshank, A. A Qualitative and Quantitative Analysis of the Obsidian Sources on Aotea (Great Barrier Island), and their Archaeological Significance. (2011).",
