Data source,,,,,,,,,,,,,,,
cruickshank2011,,,,,,,,,,,,,davidson2017,"Davidson, J. & Leach, F. Archaeological excavations at Pig Bay (N38/21, R10/22), Motutapu Island, Auckland, New Zealand, in 1958 and 1959. Records of the Auckland Museum 52, 9–38 (2017).",
cruickshank2011,,,,,,,,,,,,,campbell2018,"Campbell, M. et al. The Torpedo Bay excavations: Volume 1, the pre-European Maori site (HPA authority 2009/275). (2018).",
cruickshank2011,,,,,,,,,,,,,davidson1978,"Davidson, J. The Prehistory of Motutapu Island, New Zealand: Five Centuries of Polynesian Occupation in a Changing Landscape. Journal of the Polynesian Society 87, 327–337 (1978).",
kneebone2018,Portable ED-XRF analyses of stone tools from the region of Auckland (Tamaki) in the north island of New Zealand.,"Portable ED-XRF analyses of major and trace elements, associated with typological and technological description of stone tools fom the region of Auckland (Tamaki) in the north island of New Zealand.","Kneebone, Brendan",University of Auckland (New Zealand),"Hermann, Aymeric",aymeric.hermann@cnrs.fr,kneebone2018,"Kneebone, B. The Sharpest Tool in the Shed: A Morphological, Typological and Geochemical Analysis of Stone Adzes from the Auckland (Tamaki) Region, New Zealand. (University of Auckland, 2018).",,kneebone2018,"Kneebone, B. The Sharpest Tool in the Shed: A Morphological, Typological and Geochemical Analysis of Stone Adzes from the Auckland (Tamaki) Region, New Zealand. (University of Auckland, 2018).",,kneebone2018,"Kneebone, B. The Sharpest Tool in the Shed: A Morphological, Typological and Geochemical Analysis of Stone Adzes from the Auckland (Tamaki) Region, New Zealand. (University of Auckland, 2018).",
kneebone2018,,,,,,,,,,,,,davidson2017,"Davidson, J. & Leach, F. Archaeological excavations at Pig Bay (N38/21, R10/22), Motutapu Island, Auckland, New Zealand, in 1958 and 1959. Records of the Auckland Museum 52, 9–38 (2017).",
kneebone2018,,,,,,,,,,,,,davidson1970,"Davidson, J. M. Excavation of an 'undefended’ site, N38/37, on Motutapu island, New Zealand. Records of the Auckland Institute and Museum 7, 31–60 (1970).",
kneebone2018,,,,,,,,,,,,,davidson1972,"Davidson, J. M. Archaeological investigations on Motutapu Island, New Zealand: Introduction to recent fieldwork, and further results. Records of the Auckland Institute and Museum 9, 1–14 (1972).",
kneebone2018,,,,,,,,,,,,,davidson2011,"Davidson, J. Archaeological investigations at Maungarei: A large Mäori settlement on a volcanic cone in Auckland, New Zealand. Tuhinga, Records of the Museum of New Zealand Te Papa Tongarewa 22, 19–100 (2011).",
kneebone2018,,,,,,,,,,,,,campbell2014,"Campbell, M., Hudson, B. & Cruickshank, A. Section 18 investigations of the Long Bay Restaurant site, R10/1374, Long Bay Regional Park, Auckland  (HPA authority 2014/506). (Report to Heritage New Zealand Pouhere Taonga and Auckland Council, 2014).",
kneebone2018,,,,,,,,,,,,,campbell2011,"Campbell, M. The NRD site: the archaeology. (Report to New Zealand Historic Places Trust and Auckland International Airport Ltd, 2011).",
kneebone2018,,,,,,,,,,,,,leahy1991,"Leahy, A. Excavations at Taylor’s Hill, R11/96, Auckland. Records of the Auckland Institute and Museum 28, 33–68 (1991).",
kneebone2018,,,,,,,,,,,,,leahy1970,"Leahy, A. Excavations at site N38/30, Motutapu Island, New Zealand. Records of the Auckland Institute and Museum 7, 61–82 (1970).",
kneebone2018,,,,,,,,,,,,,furey1986,"Furey, L. The excavation of Westfield (R11/898), South Auckland. Records of the Auckland Institute and Museum 23, 1–24 (1986).",
kneebone2018,,,,,,,,,,,,,sewell1992,"Sewell, B. Further excavations at the Westfield site (R11/898), Tamaki, Auckland. (Auckland Conservancy Historic Resource Series, 1. Department of Conservation., 1992).",
kneebone2018,,,,,,,,,,,,,campbell2019,"Campbell, M. et al. The Long Bay Restaurant site, R10/1374: Volume 1, the archaeology (HNZPTA authorities 2015/19 and 2016/81). 182 (2019).",
kneebone2016,Portable ED-XRF analyses of major and trace elements of obsidian artefacts fom the Maungataketake/Elletts Mountain site.,Portable ED-XRF analyses of major and trace elements of obsidian artefacts fom the Maungataketake/Elletts Mountain site.,"Kneebone, Brendan",University of Auckland (New Zealand),"Hermann, Aymeric",aymeric.hermann@cnrs.fr,kneebone2016,"Kneebone, B 2016 Spatial Interactions and Communications: A Geochemical Analysis of Obsidian from the Tamaki region. BA (Hons) Dissertation, University of Auckland.",,kneebone2016,"Kneebone, B 2016 Spatial Interactions and Communications: A Geochemical Analysis of Obsidian from the Tamaki region. BA (Hons) Dissertation, University of Auckland.",,mckinlay1974,"McKinlay, J. R. Elletts Mountain Excavation 1973-74. NZHPT Newsletter 3, 4–6 (1974).",
kneebone2016,,,,,,,,,,,,,mckinlay1975,"McKinlay, J. R. Elletts Mountain Excavation 1974-75. NZHPT Newsletter 5, 6 (1975).",
kneebone2016,,,,,,,,,,,,,mckinlay1983,"McKinlay, J. R. Elletts Mountain Excavation. NZHPT Newsletter 19, 6 (1983).",
golitko2013,Sepik coast and islands obsidian,Obsidian sourcing of artifacts collected along the Sepik coast and islands of northern Papua New Guinea (East and West Sepik provinces),"Golitko, M. (1), Schauer, M. (2), Terrell, J.E. (1)","1. Deparment of Anthropology, Field Museum of Natural History, Chicago, IL, USA.
2. Department of Anthropology, University of Illinois at Chicago, Chicago, IL, USA.","Golitko, Mark",mgolitko@nd.edu,golitko2013,"Golitko, M., Schauer, M., & Terrell, J.E. Obsidian acquisition on the Sepik coast of northern Papua New Guinea during the last two Millennia. In Pacific Archaeology: Documenting the Past 50,000 Years (eds. Summerhayes, G., Buckley, H.) 43-57. (University of Otago, 2013)",,terrell2011a,"Terrell, J. E. Archaeological Surveys (Exploring Prehistory on the Sepik Coast of Papua New Guinea). Fieldiana Anthropology 42, 35–68 (2011).",10.3158/0071-4739-42.1.29,terrell2011a,"Terrell, J.E. Archaeological Surveys. in Exploring Prehistory on the Sepik Coast of Papua New Guinea (eds. Terrell, J.E., Schechter, E.M.) 35-68 (Field Museum of Natural History, 2011). doi:10.3158/0071-4739-42.1.251",10.3158/0071-4739-42.1.29
golitko2013,,,,,,,,,,terrell2011,"Terrell, J.E. Archaeological Excavations. in Exploring Prehistory on the Sepik Coast of Papua New Guinea (eds. Terrell, J.E., Schechter, E.M.) 69-86 (Field Museum of Natural History, 2011). doi:10.3158/0071-4739-42.1.251",10.3158/0071-4739-42.1.29,terrell2011,"Terrell, J.E. Archaeological Excavations. in Exploring Prehistory on the Sepik Coast of Papua New Guinea (eds. Terrell, J.E., Schechter, E.M.) 69-86 (Field Museum of Natural History, 2011). doi:10.3158/0071-4739-42.1.251",10.3158/0071-4739-42.1.29
golitko2013,,,,,,,,,,,,,golitko2013,"Golitko, M., Schauer, M., & Terrell, J.E. Obsidian acquisition on the Sepik coast of northern Papua New Guinea during the last two Millennia. In Pacific Archaeology: Documenting the Past 50,000 Years (eds. Summerhayes, G., Buckley, H.) 43-57. (University of Otago, 2013)",
reepmeyer2008,Banks Islands obsidian sources,Twenty-nine source samples from volcanic glass deposits on Vanua Lava and Gaua Islands were analysed using EDXA-SEM and LA-ICP-MS with a focus on detecting possible intrasource variation. The results show both Banks Islands deposits are readily distinguishable from each other and from other sources in the region and their chemical compositions are highly homogenous.,"Reepmeyer,Christian","Australian National University, Canberra",Christian Reepmeyer,christian.reepmeyer@jcu.edu.au,reepmeyer2008,"Reepmeyer, C. Characterising volcanic glass sources in the Banks Islands, Vanuatu. Archaeology in Oceania 43, 120–127 (2008).",https://doi.org/10.1002/j.1834-4453.2009.tb00038.x,reepmeyer2008,"Reepmeyer, C. Characterising volcanic glass sources in the Banks Islands, Vanuatu. Archaeology in Oceania 43, 120–127 (2008).",https://doi.org/10.1002/j.1834-4453.2009.tb00038.x,reepmeyer2008,"Reepmeyer, C. Characterising volcanic glass sources in the Banks Islands, Vanuatu. Archaeology in Oceania 43, 120–127 (2008).",https://doi.org/10.1002/j.1834-4453.2009.tb00038.x
reepmeyer2008,,,,,,,,,,reepmeyer2009,"Reepmeyer, C. The obsidian sources and distribution systems emanating from Gaua and Vanua Lava in the Banks Islands of Vanuatu. (Australian National University, 2009).",,reepmeyer2009,"Reepmeyer, C. The obsidian sources and distribution systems emanating from Gaua and Vanua Lava in the Banks Islands of Vanuatu. (Australian National University, 2009).",
reepmeyer2010a,Sourcing of Teouma obsidian artefacts,"Summary analysis of obsidian artefacts from the early Lapita site of Teouma (Efate, Vanuatu)","Reepmeyer,Christian","Australian National University, Canberra",Christian Reepmeyer,christian.reepmeyer@jcu.edu.au,reepmeyer2010a,"Reepmeyer, C., Spriggs, M., Bedford, S. & Ambrose, W. Provenance and Technology of Lithic Artifacts from the Teouma Lapita Site, Vanuatu. Asian Perspectives 49, 205–225 (2010).",,reepmeyer2010a,"Reepmeyer, C., Spriggs, M., Bedford, S. & Ambrose, W. R. Provenance and technology of lithic artefacts from the Teouma Lapita Site, Vanuatu. Asian Perspect. 49, 205–225 (2011).",,bedford2009a,"Bedford, S., Spriggs, M., Buckley, H., Valentin, F. & Regenvanu, R. The Teouma Lapita Site, South Efate, Vanuatu: A summary of three Field seasons (2004-2006). in Lapita: Ancestors and Descendants (eds. Sheppard, P. J., Thomas, T. & Summerhayes, G. R.) 215–234 (New Zealand Archaeological Association, 2009).",
reepmeyer2012,Obsidian artefacts in Tonga,"Summary of newly excavated obsidian artefacts from Tongatapu, Tonga","Reepmeyer,Christian","Australian National University, Canberra",Christian Reepmeyer,christian.reepmeyer@jcu.edu.au,reepmeyer2012,"Reepmeyer, C., Clark, G. & Sheppard, P. Obsidian Source Use in Tongan Prehistory: New Results and Implications. The Journal of Island and Coastal Archaeology 7, 255–271 (2012).",10.1080/15564894.2011.611858,reepmeyer2012,"Reepmeyer, C., Clark, G. & Sheppard, P. Obsidian Source Use in Tongan Prehistory: New Results and Implications. The Journal of Island and Coastal Archaeology 7, 255–271 (2012).",10.1080/15564894.2011.611858,reepmeyer2012,"Reepmeyer, C., Clark, G. & Sheppard, P. Obsidian Source Use in Tongan Prehistory: New Results and Implications. The Journal of Island and Coastal Archaeology 7, 255–271 (2012).",10.1080/15564894.2011.611858
reepmeyer2012,,,,,,,,,,,,,valentin2013,"Valentin, F. & Clark, G. Early Polynesian mortuary behaviour at the Talasiu site, Kingdom of Tonga. Journal of Pacific Archaeology 4, 1–14 (2013).",
reepmeyer2012,,,,,,,,,,,,,clark2014a,"Clark, G. & Reepmeyer, C. Stone architecture, monumentality and the rise of the early Tongan chiefdom. Antiquity 88, 1244–1260 (2014).",
weisler2015,Characterization of the quarry site MO-B6-161 on Moloka'i island (Hawai'i),The authors provide major element data to characterize the geochemical variability of the quarry site MO-B6-161 on Moloka'i island (Hawai'i),"Marshall I. Weisler (1), Walter P. Mendes (2), Quan Hua (3)","(1)School of Social Science, University of Queensland, St Lucia, Queensland 4072, Australia
(2) P. O. Box 144, Ho'olehua, Hawai'i 96729 USA
(3) Australian Nuclear Science and Technology Organisation (ANSTO), PMB 1, Menai, New South Wales 2234, Australia","Hermann, Aymeric",aymeric.hermann@cnrs.fr,weisler2015,"Weisler, M. I., Mendes, W. P. & Hua, Q. A Prehistoric Quarry/Habitation Site on Moloka'i and a Discussion of an Anomalous Early Date on the Polynesian Introduced Candlenut (kukui, Aleurites moluccana). Journal of Pacific Archaeology 6, 37–57 (2015).",,weisler2015,"Weisler, M. I., Mendes, W. P. & Hua, Q. A Prehistoric Quarry/Habitation Site on Moloka'i and a Discussion of an Anomalous Early Date on the Polynesian Introduced Candlenut (kukui, Aleurites moluccana). Journal of Pacific Archaeology 6, 37–57 (2015).",,weisler2015,"Weisler, M. I., Mendes, W. P. & Hua, Q. A Prehistoric Quarry/Habitation Site on Moloka'i and a Discussion of an Anomalous Early Date on the Polynesian Introduced Candlenut (kukui, Aleurites moluccana). Journal of Pacific Archaeology 6, 37–57 (2015).",
weisler2015,,,,,,,,,,,,,dixon1994,"Dixon, B., Major, M., Carpenter, A., Stine, C. & Longton, B. Lithic tool production and dryland planting adaptations to regional agricultural intensification: preliminary evidence from leeward Moloka'i, Hawai'i. Bishop Museum Occasional Papers 39, 1–19 (1994).",
weisler2013,Nānākuli Valley quarry site on O'ahu island (Hawai'i),"Comprehensive description of the geochemical composition of the Nānākuli quarry complex including major element concentrations, 43 trace element abundances, and high-precision Sr-Nd-Pb isotopic ratios on nine samples.","Marshall I. Weisler (1), Sara L. Collins (2), Yuexing Feng (3), Jian-xin Zhao (3), Ceri Shipton (1), Xun Wei (4)","(1) School of Social Science, Michie Building, University of Queensland, St Lucia, Qld 4072, Australia
(2) Pacific Consulting Services, Inc., Honolulu, Hawai'i
(3) Radiogenic Isotopes Facilities, Centre for Microscopy and Microanalysis, University of Queensland, St Lucia, Qld 4072, Australia
(4) State Key Laboratory of Isotope Geochemistry, Guangzhou Institute of Geochemistry, Chinese Academy of Sciences, Guangzhou, 510640, PR China","Hermann, Aymeric",aymeric.hermann@cnrs.fr,weisler2013,"Weisler, M. et al. A New Major Adze Quarry from Nānākuli, O'ahu: Implications for Interaction Studies in Hawai'i. Journal of Pacific Archaeology 4, 35–57 (2013).",,weisler2013,"Weisler, M. et al. A New Major Adze Quarry from Nānākuli, O'ahu: Implications for Interaction Studies in Hawai'i. Journal of Pacific Archaeology 4, 35–57 (2013).",,weisler2013,"Weisler, M. et al. A New Major Adze Quarry from Nānākuli, O'ahu: Implications for Interaction Studies in Hawai'i. Journal of Pacific Archaeology 4, 35–57 (2013).",
rolett1998,Hanamiai adze and flake assemblage (Southern Marquesas Islands),"WD-XRF and electron-microprobe (EMP) analysis of major elements of artefacts from Hanamiai dune site, Tahuata Island, identifies local and extra-island sources.","Rolett, B.V.",University of Hawai'i at Manoa (USA),"Hermann, Aymeric",aymeric.hermann@cnrs.fr,rolett1998,"Rolett, B. V. Hanamiai: Prehistoric Colonization and Cultural Change in the Marquesas Islands, East Polynesia. (Department of Anthropology and The Peabody Museum, Yale University, 1998).",,rolett1998,"Rolett, B. V. Hanamiai: Prehistoric Colonization and Cultural Change in the Marquesas Islands, East Polynesia. (Department of Anthropology and The Peabody Museum, Yale University, 1998).",,rolett1998,"Rolett, B. V. Hanamiai: Prehistoric Colonization and Cultural Change in the Marquesas Islands, East Polynesia. (Department of Anthropology and The Peabody Museum, Yale University, 1998).",
rolett1998,,,,,,,,,,,,,sinoto1965,"Sinoto, Y. H. & Kellum, M. Preliminary Report on Excavations in the Marquesas Islands, French Polynesia. Unpublished report. (1965).",
johnson2013,"Quarry of Lau'agae and artefacts of the Tula site (Tutuila, American Samoa)",Instrumental Neutron Activation Analysis (INAA) and Energy Dispersive X-ray Fluorescence (EDXRF) were used to characterize artefacts and quarries in Tutuila (American Samoa).,"Johnson, Phillip R.",Texas A&M University,"Hermann, Aymeric",aymeric.hermann@cnrs.fr,johnson2013,"Johnson, P. R. Elemental and Technological Analyses of Basalt Adze Manufacture on Tutuila, Amerika Samoa: Economic Intensification and Specialization During the Monument Building Period. (Texas A&M University, 2013).",,johnson2013,"Johnson, P. R. Elemental and Technological Analyses of Basalt Adze Manufacture on Tutuila, Amerika Samoa: Economic Intensification and Specialization During the Monument Building Period. (Texas A&M University, 2013).",,johnson2013,"Johnson, P. R. Elemental and Technological Analyses of Basalt Adze Manufacture on Tutuila, Amerika Samoa: Economic Intensification and Specialization During the Monument Building Period. (Texas A&M University, 2013).",
johnson2013,,,,,,,,,,,,,moore1996,"Moore, J. R. & Kennedy, J. Archaeological Resources on Lau’agae Ridge:A Phase II Cultural Resource Evaluation of Site AS-21-100 (the Lau’agae Ridge Quarry), for Phase III of the Onenoa Road Project Located in East Vaifanua County, Tutuila Island, American Samoa. (1996).",
johnson2013,,,,,,,,,,,,,clark1997,"Clark, J. T., Wright, E. & Herdrich, D. J. Interactions within and beyond the Samoan archipelago: evidence from basaltic rock geochemistry. in Prehistoric Long-Distance Interaction in Oceania: An Interdisciplinary Approach (ed. Weisler, M. I.) vol. 21 68–83 (New Zealand Archaeological Association, 1997).",
johnson2013,,,,,,,,,,,,,frost1978,"Frost, J. Archaeological investigations on Tutuila, American Samoa. (University of Oregon, 1978).",
johnson2013,,,,,,,,,,,,,clark1988,"Clark, J. T. The Eastern Tutuila Archaeological Project, 1988. Final Report. (1988).",
mccoy2020,EDXRF analysis of obsidian and volcanic glass artefact from the Polynesian Outlier island of Tikopia,"Characterization of obsidian and volcanic glass artefacts from Tikopia (Temotu, Solomon islands) using Energy Dispersive X-ray Fluorescence (EDXRF)","Mark D. McCoy (a);
Caroline Cervera (b);
Mara A. Mulrooney (c);
Andrew McAlister (d);
Patrick V. Kirch (e)","a.Department of Anthropology, Southern Methodist University, Dallas, Texas 75275, USA; b. College of Social Sciences and Humanities, Northeastern University, Boston, Massachusetts 02115, USA; c. Pacific Legacy, Inc., Kailua, Hawaii 96734, USA; d. Anthropology, School of Social Sciences, University of Auckland, Auckland 1142, New Zealand; e. Department of Anthropology, University of Hawaii at Mānoa, Honolulu, Hawaii 96822, USA","Hermann, Aymeric",aymeric.hermann@cnrs.fr,mccoy2020,"McCoy, M. D., Cervera, C., Mulrooney, M. A., McAlister, A. & Kirch, P. V. Obsidian and volcanic glass artifact evidence for long-distance voyaging to the Polynesian Outlier island of Tikopia. Quaternary Research 1–9 (2020).",10.1017/qua.2020.38,mccoy2020,"McCoy, M. D., Cervera, C., Mulrooney, M. A., McAlister, A. & Kirch, P. V. Obsidian and volcanic glass artifact evidence for long-distance voyaging to the Polynesian Outlier island of Tikopia. Quaternary Research 1–9 (2020).",10.1017/qua.2020.38,mccoy2020,"McCoy, M. D., Cervera, C., Mulrooney, M. A., McAlister, A. & Kirch, P. V. Obsidian and volcanic glass artifact evidence for long-distance voyaging to the Polynesian Outlier island of Tikopia. Quaternary Research 1–9 (2020).",10.1017/qua.2020.38
mccoy2020,,,,,,,,,,,,,kirch1982,"Kirch, P. V. & Yen, D. E. Tikopia. The Prehistory and Ecology of a Polynesian Outlier. (Bernice P. Bishop Museum, 1982).",
reepmeyer2011,SEM/EDXA and LA-ICPMS analysis of artefacts from the Jerimalai site in East Timor.,Characterization of obsidian artefacts from Jerimalai shelter in East Timor using SEM/EDXA and LA-ICPMS. These are presumably exogenous to the island but the detailed provenance remains unknown.,"Christian Reepmeyer (a), Sue O'Connor (a), Sally Brockwell (a)","(a) Australian National University, Canberra","Hermann, Aymeric",aymeric.hermann@cnrs.fr,reepmeyer2011,"Reepmeyer, C., O’connor, S. & Brockwell, S. Long-term obsidian use at the Jerimalai rock shelter in East Timor. Archaeology in Oceania 46, 85–90 (2011).",10.1002/j.1834-4453.2011.tb00102.x,reepmeyer2011,"Reepmeyer, C., O’connor, S. & Brockwell, S. Long-term obsidian use at the Jerimalai rock shelter in East Timor. Archaeology in Oceania 46, 85–90 (2011).",10.1002/j.1834-4453.2011.tb00102.x,reepmeyer2011,"Reepmeyer, C., O’connor, S. & Brockwell, S. Long-term obsidian use at the Jerimalai rock shelter in East Timor. Archaeology in Oceania 46, 85–90 (2011).",10.1002/j.1834-4453.2011.tb00102.x
reepmeyer2011,,,,,,,,,,,,,oconnor2007,"O’Connor, S. New evidence from East Timor contributes to our understanding of earliest modern human colonisation east of the Sunda Shelf. Antiquity 81, 523–535 (2007).",10.1017/S0003598X00095569
mccoy2011,Volcanic glass artifacts matched to Pu'u Wa'awa'a source based on chemistry and visual identification later verified by chemistry. See reference for details on methods and laboratories used.,Volcanic glass artefacts matched to Pu'u Wa'awa'a source based on pXRF analysis chemistry and visual identification later verified by chemistry. See reference for details on methods and laboratories used.,"Mark D. McCoy (a), Peter R. Mills (b), Steven Lundblad (b), Tim Rieth (c), Jennifer G. Kahn (d), Rowan Gard (d)","(a) University of Otago, Department of Anthropology, P.O. Box 56, Dunedin 9054, New Zealand 
(b) University of Hawaii, Hilo, HI, USA
(c) International Archaeological Research Institute, Inc., HI, USA
(d) Bernice P. Bishop Museum, HI, USA","Hermann, Aymeric",aymeric.hermann@cnrs.fr,mccoy2011,"McCoy, M. D. et al. A cost surface model of volcanic glass quarrying and exchange in Hawai'i. Journal of Archaeological Science 38, 2547–2560 (2011).",10.1016/j.jas.2011.04.017,mccoy2011,"McCoy, M. D. et al. A cost surface model of volcanic glass quarrying and exchange in Hawai'i. Journal of Archaeological Science 38, 2547–2560 (2011).",10.1016/j.jas.2011.04.017,mccoy2011,"McCoy, M. D. et al. A cost surface model of volcanic glass quarrying and exchange in Hawai'i. Journal of Archaeological Science 38, 2547–2560 (2011).",10.1016/j.jas.2011.04.017
mccoy2011,,,,,,,,,,,,,barrera1974,"Barrera, W. M. & Kelly, M. A. Archaeological and Historical Surveys af the Waimea to Kawaihae Road Corridor, Island of Hawaii. (1974).",
mccoy2011,,,,,,,,,,,,,clark1983,"Clark, J. T. & Kirch, P. V. Archaeological Investigations of the Mudlane- Waimea-Kawaihae Road Corridor, Island of Hawai. (1983).",
mccoy2011,,,,,,,,,,,,,kirch1979,"Kirch, P. V. Marine Exploitation in Prehistoric Hawai’i: Archaeological investigations at Kalahuipua’a, Hawai’i island. (Bishop Museum, 1979).",
mccoy2011,,,,,,,,,,,,,clark1981,"Clark, J. T. Archaeological Survey of Proposed Lalamilo Agricultural Park, S. Kohala, Hawaii. (1981).",
mccoy2011,,,,,,,,,,,,,toenjes1986,"Toenjes, J. H. Archaeological monitoring in the Kuakini Highway realignment, Kona, Hawaii. (1986).",
mccoy2011,,,,,,,,,,,,,schilt1984,"Schilt, A. R. Subsistence and conflict in Kona, Hawai’i: An archaeological study of the Kuakini Highway Realignment Corridor. (1984).",
mccoy2011,,,,,,,,,,,,,sinoto1970a,"Sinoto, Y. H. & Kelly, M. A. Archaeological and Historical Survey of Pakini-nui and Pakini-iki Coastal Sites, Waiahukini, Kailikii and Hawea, Ka’u, Hawaii. (1970).",
mccoy2011,,,,,,,,,,,,,emory1970,"Emory, Report 70-12, p. 12 Waiahukini Site Records B/W photos: HA(a) 9-9",
mccoy2011,,,,,,,,,,,,,rozier1971,"Rozier, S. N. Archaeological Excavations at Kamehameha III Road, North Kona, Island of Hawaii, Phase II. (1971).",
mccoy2011,,,,,,,,,,,,,barrera1971,"Barrera, W. M. Anaehoomalu: A Hawaiian oasis. (Department of Anthropology, BPBM, 1971).",
mccoy2011,,,,,,,,,,,,,rosendahl1969,"Rosendahl, P. H. An Archaeological Survey of Ouli Coastal Lands Between Hapuna Bay and Kaunaoa Bay, South Kohala, Hawaii. (1969).",
mccoy2011,,,,,,,,,,,,,cordy1985,"Cordy, R. H. Archaeological Data Recovery at C22-27 in KalamakapalaAhupuaa in the Kealakekua Bay Region (South Kona, Hawaii). (1985).",
mccoy2011,,,,,,,,,,,,,soehren1964,"Soehren, L. J. An Archaeological Survey of the Shores of Ouli and Kawaihae, South Kohala, Hawaii. (1964).",
mills2011,EDXRF analysis of 955 basalt flakes and cores recovered from Kahalu'u Habitation Cave in the Kona district (~AD 1600–1800).,Provenance analysis of basalt adzes and flakes from the Kahalu'u rockshelter exploring the non-centralised exchange networks in pre-Contact Hawai'i island.,"Peter R. Mills (1), Steven P. Lundblad (2), Ken Hon (2), Jadelyn J. Moniz Nakamura (3), Elizabeth L. Kahahane (1), Arian Drake-Raue (1), Tanya M. Souza (4), Richard Wei (1)","1. Department of Anthropology, University of Hawai'i, Hilo, Hawai'i
2. Department of Geology, University of Hawai'i, Hilo, Hawai'i
3. Hawai'i Volcanoes National Park, Hawai'i
4. Department of Anthropology, University of Hawai'i, Mānoa, Hawai'i","Hermann, Aymeric",aymeric.hermann@cnrs.fr,mills2011,"Mills, P. R. et al. Reappraising craft specialization and exchange in pre-contact Hawai`i through non-destructive sourcing of basalt adze debitage. Journal of Pacific Archaeology 2, 79–92 (2011).",,mills2011,"Mills, P. R. et al. Reappraising craft specialization and exchange in pre-contact Hawai`i through non-destructive sourcing of basalt adze debitage. Journal of Pacific Archaeology 2, 79–92 (2011).",,mills2011,"Mills, P. R. et al. Reappraising craft specialization and exchange in pre-contact Hawai`i through non-destructive sourcing of basalt adze debitage. Journal of Pacific Archaeology 2, 79–92 (2011).",
mills2011,,,,,,,,,,,,,hay1986,"Hay, D., Haun, A. E., Rosendahl, P. H. & Severance, C. J. Kahalu’u data recovery project: Excavations at site 50-10-37-7702, Kahalu’u habitation cave, land of Kahalu’u, North Kona, island of Hawai’i. Report submitted by P.H. Rosendhal, Inc. (1986).",
mills2011,,,,,,,,,,,,,lass1994,"Lass, B. Hawaiian Adze Production and Distribution. Implications for the Development of Chiefdoms. (UCLA Institute of Archaeology, 1994).",
