ID,Entry_Type,address,author,booktitle,collaborator,copyright,doi,edition,editor,eprint,eprinttype,googlebooks,ids,institution,isbn,issn,journal,jstor,keywords,langid,month,note,number,pages,pmcid,publisher,school,series,shorttitle,title,type,urldate,volume,year
mulrooney2016,article,,"Mulrooney, Mara and Torrence, Robin and McAlister, Andrew",,,,10.1002/arco.5069,,,,,,,,,1834-4453,Archaeology in Oceania,,"geochemical sourcing,Melanesia,obsidian,Oceania,portable X-ray fluorescence,Rapa Nui (Easter Island)",english,,,1,62--69,,,,,The Demise of a Monopoly,The Demise of a Monopoly: {{Implications}} of Geochemical Characterisation of a Stemmed Obsidian Tool from the {{Bishop Museum}} Collections,,2021-05-18,51,2016
nagaoka2022,article,,"Nagaoka, Takuya and Sheppard, Peter J. and {Ross-Sheppard}, Callan and Kononenko, Nina",,,,,,,,,,,,,2230-5955,Journal of the Polynesian Society,,post-settlement interaction,english,,,4,389--426,,,,,"Obsidian {{Point Discovered}} on {{Kapingamarangi Atoll}}, {{Micronesia}}","Obsidian {{Point Discovered}} on {{Kapingamarangi Atoll}}, {{Micronesia}}: {{Implications}} for {{Post-Settlement Regional Interactions}}",,2023-04-05,131,2022
natland1985,incollection,Houston,"Natland, J.H. and Turner, D.L.",Geological {{Investigations}} of the {{Northern Melanesian Borderland}},,,,,,,,,,,,,,,,,,,,139--171,,{Circum- Pacific Council for Energy and Resources},,,,"Age Progression and Petrological Development of {{Samoan}} Shield Volcanoes: {{Evidence}} from {{K-Ar}} Ages, Lava Compositions and Mineral Studies",,,,1985
neri2007,article,,"Neri, Leee Anthony M.",,,,10.7152/bippa.v27i0.11987,,,,,,,,,1835-1794,Bulletin of the Indo-Pacific Prehistory Association,,,american,September,,,154--162,,,,,,Philippine Obsidian and Its Archaeological Applications,,2021-05-21,27,2007
neri2019,article,,"Neri, Leee Anthony M.",,,,10.1515/opar-2019-0012,,,,,,,,,,Open Archaeology,,,english,April,,1,167--179,,De Gruyter,,,Obsidian {{Sourcing}} and {{Characterization}} in the {{Celebes Region}},Obsidian {{Sourcing}} and {{Characterization}} in the {{Celebes Region}}: {{An Initial Interpretation}} on the ``{{Celebes Seafaring People}}'',,2020-11-17,5,2019
oconnor2007,article,,"O'Connor, Sue",,,,10.1017/S0003598X00095569,,,,,,,,,"0003-598X, 1745-1744",Antiquity,,"East Timor,Homo floresiensis,Homo sapiens,human colonisation,Island Southeast Asia,Pleistocene",english,September,Oconnor-2007-Antiquity,313,523--535,,Cambridge University Press,,,,New Evidence from {{East Timor}} Contributes to Our Understanding of Earliest Modern Human Colonisation East of the {{Sunda Shelf}},,2020-09-16,81,2007
oliveira2008,phdthesis,,"Oliveira, Nuno Vasco",,,,,,,,,,,,,,,,,english,,,,,,,Australian National University,,Subsistence Archaeobotany,Subsistence Archaeobotany: {{Food}} Production and the Agricultural Transition in {{East Timor}},,2020-09-19,,2008
ottino1985,article,,"Ottino, Pierre",,,,10.3406/jso.1985.2799,,,,,,,,,,Journal de la Soci\'et\'e des Oc\'eanistes,,,fre,,,80,33--37,,,,,,"{Un site ancien aux \^iles Marquises : l'abri-sous-roche d'Anapua, \`a Ua Pou.}",,,41,1985
pengilley2019,article,,"Pengilley, Alana and Brand, Christabel and Flexner, James and Specht, Jim and Torrence, Robin",,,,10.1002/arco.5188,,,,,,,,,1834-4453,Archaeology in Oceania,,"adzes,axes,echange,exchange,Ground stone,haches,herminettes,Papouasie Nouvelle Guinee,Papua New Guinea,pierre broyee,portable XRF,XRF portable",english,,,3,200--213,,,,,"Detecting Exchange Networks in {{New Britain}}, {{Papua New Guinea}}","Detecting Exchange Networks in {{New Britain}}, {{Papua New Guinea}}: {{Geochemical}} Comparisons between Axe-Adze Blades and in Situ Volcanic Rock Sources",,2020-11-07,54,2019
polach1968,article,,"Polach, H. A. and Golson, J. and Lovering, J. F. and Stipp, J. J.",,,,10.1017/S0033822200010870,,,,,,,,,"0033-8222, 1945-5755",Radiocarbon,,,english,,,2,179--199,,Cambridge University Press,,,,{{ANU Radiocarbon Date List II}},,2021-05-19,10,1968/ed
poulsen1967,phdthesis,,"Poulsen, Jens",,,,,,,,,,,,,,,,,,,,,,,,Australian National University,,,A {{Contribution}} to the {{Prehistory}} of the {{Tongan Islands}},,,,1967
poulsen1987,book,"ANU, Canberra, Australia","Poulsen, Jens",,,,,,,,,,,,,,,,,,,,,,,"Department of Prehistory, Research School of Pacific Studies",,,,Early {{Tongan}} Prehistory : {{The Lapita}} Period on {{Tongatapu}} and Its Relationships,,,,1987
putzi2015,article,,"Putzi, Jeffrey L. and DiVito, Nathaniel J. and Sholin, Carl E. and Mills, Peter R. and Lundblad, Steven and Camara, Bobby and Dye, Thomas S.",,,,10.1016/j.jasrep.2015.03.006,,,,,,,,,2352-409X,Journal of Archaeological Science: Reports,,"Common pooled resource,EDXRF,Exchange,Hawai'i,Social complexity,Volcanic glass",english,June,,,341--352,,,,,,Alternative Models of Volcanic Glass Quarrying and Exchange in {{Hawai}}'i,,2020-09-27,2,2015
quintus2015,phdthesis,"Auckland, New Zealand","Quintus, Seth",,,,,,,,,,,,,,,,,,,,,,,,University of Auckland,,,Dynamics of Agricultural Development in Prehistoric {{Samoa}}: {{The}} Case of {{Ofu Island}},,,,2015
quintus2016,article,,"Quintus, Seth and Clark, Jeffrey T.",,,,10.1080/00438243.2016.1195576,,,,,,,,,0043-8243,World Archaeology,,"Habitus,landscape archaeology,Polynesia,Samoa,spatial logic",,May,,3,395--410,,Routledge,,,Space and Structure in {{Polynesia}},Space and Structure in {{Polynesia}}: {{Instantiated}} Spatial Logic in {{American S\=amoa}},,2023-11-02,48,2016
quintus2017,article,,"Quintus, Seth and Day, Stephanie S. and Smith, Nathan J.",,,,10.1017/aap.2017.13,,,,,,,,,2326-3768,Advances in Archaeological Practice,,,english,November,,4,351--364,,Cambridge University Press,,,,The {{Efficacy}} and {{Analytical Importance}} of {{Manual Feature Extraction Using Lidar Datasets}},,2023-11-02,5,2017
quintus2022,article,,"Quintus, Seth and Mills, Peter and Konter, Jasper and Day, Stephanie and Gilreath, Darr and Kekuewa Lincoln, Noa and Lundblad, Steven and Vonderhaar, Denys and Yoo, Kyungsoo",,,,10.1007/s12520-022-01571-w,,,,,,,,,1866-9565,Archaeol Anthropol Sci,,"Collective action,Common pool resources,EDXRF,Geochemistry,ICPMS,Polynesia",english,May,,6,103,,,,,,Trace Element and {{Pb}} Isotope Analyses Highlight Decentralized Inter-Island Exchange in {{American S\=amoa}} ({{Polynesia}}),,2023-11-02,14,2022
reepmeyer2008,article,,"Reepmeyer, Christian",,,,10.1002/j.1834-4453.2009.tb00038.x,,,,,,reepmeyer2008a,,,1834-4453,Archaeology in Oceania,,"EDXA-SEM,Laser ablation ICP-MS,Obsidian,Provenance studies,Western Remote Oceania",english,,,3,120--127,,,,,,"Characterising Volcanic Glass Sources in the {{Banks Islands}}, {{Vanuatu}}",,2019-10-24,43,2008
reepmeyer2009,phdthesis,,"Reepmeyer, Christian",,,,,,,,,,,,,,,,,australian,,,,,,,Australian National University,,,The Obsidian Sources and Distribution Systems Emanating from {{Gaua}} and {{Vanua Lava}} in the {{Banks Islands}} of {{Vanuatu}},,2019-10-24,,2009
reepmeyer2010,article,,"Reepmeyer, C. and Clark, G.",,,,10.1111/j.1475-4754.2009.00465.x,,,,,,,,,1475-4754,Archaeometry,,"FIJI,GEOCHEMISTRY,OBSIDIAN,POST-LAPITA,SOURCING",english,,,1,1--18,,,,,Post-{{Colonization Interaction Between Vanuatu}} and {{Fiji Reconsidered}},"Post-{{Colonization Interaction Between Vanuatu}} and {{Fiji Reconsidered}}: {{The Re-Analysis}} of {{Obsidian}} from {{Lakeba Island}}, {{Fiji}}",,2019-08-27,52,2010
reepmeyer2010a,article,,"Reepmeyer, Christian and Spriggs, Matthew and Bedford, Stuart and Ambrose, Wallace",,,,10.1353/asi.2010.0004,,,,,,reepmeyer2010b,,,1535-8283,Asian Perspectives,,,english,,,1,205--225,,,,,,"Provenance and {{Technology}} of {{Lithic Artifacts}} from the {{Teouma Lapita Site}}, {{Vanuatu}}",,2020-02-23,49,2010
reepmeyer2011,article,,"Reepmeyer, Christian and O'connor, Sue and Brockwell, Sally",,,,10.1002/j.1834-4453.2011.tb00102.x,,,,,,,,,1834-4453,Archaeology in Oceania,,"East Timor,Island Southeast Asia,LA-ICPMS,obsidian,Pleistocene",english,,,2,85--90,,,,,,Long-Term Obsidian Use at the {{Jerimalai}} Rock Shelter in {{East Timor}},,2020-09-14,46,2011
reepmeyer2012,article,,"Reepmeyer, Christian and Clark, Geoffrey and Sheppard, Peter",,,,10.1080/15564894.2011.611858,,,,,,,,,1556-4894,The Journal of Island and Coastal Archaeology,,"colonization,maritime connection of Polynesian chiefdoms,obsidian,provenance studies",,May,,2,255--271,,,,,Obsidian {{Source Use}} in {{Tongan Prehistory}},Obsidian {{Source Use}} in {{Tongan Prehistory}}: {{New Results}} and {{Implications}},,2019-10-24,7,2012
reepmeyer2021,article,,"Reepmeyer, Christian and Ferguson, Redbird and Valentin, Fr{\'e}d{\'e}rique and Clark, Geoffrey R.",,,,10.1002/arco.5223,,,,,,,,,1834-4453,Archaeology in Oceania,,"adzes,Archeologie du Pacifique,geochemistry,geochimie,herminette,lithics,lithiques,obsidian,obsidienne,Pacific archaeology,Tonga",english,,,,,,,,,,"The Stone Adze and Obsidian Assemblage from the {{Talasiu}} Site, {{Kingdom}} of {{Tonga}}",,2021-01-22,,2021
rieth2008,article,,"Rieth, Timothy M. and Morrison, Alex E. and Addison, David J.",,,,10.1080/15564890802128975,,,,,,,,,1556-4894,The Journal of Island and Coastal Archaeology,,"chronometric hygiene,GIS,island colonization,Lapita,Samoa",,October,,2,214--239,,,,,,The {{Temporal}} and {{Spatial Patterning}} of the {{Initial Settlement}} of {{S\=amoa}},,2018-02-15,3,2008
robinson2016,phdthesis,"Dunedin, New Zealand","Robinson, James Justin",,,,,,,,,,,,,,,,,english,,,,,,,University of Otago,,,"Tawhiti {{Rahi}}: {{Nga Poito}} o Te {{Kupenga}} o {{Toi}} Te {{Huatahi}}---{{A Float}} of the {{Fishing Net}} of {{Toi}} Te {{Huatahi}}. {{A Multi-Disciplinary Study}} of {{M\=aori Settlement}} of {{Tawhiti Rahi}}, an {{Offshore Island}} in {{Northern New Zealand}}",,,,2016
rogers1974,article,,"Rogers, Garth",,,,,,,20705007,jstor,,,,,0032-4000,Journal of the Polynesian Society,20705007,,,,,3,308--348,,Polynesian Society,,,,"Archaeological Discoveries on {{Niuatoputapu Island}}, {{Tonga}}",,2021-02-17,83,1974
rolett1995,article,,"Rolett, Barry V. and Conte, Eric",,,,,,,20706615,jstor,,,,,0032-4000,Journal of the Polynesian Society,20706615,,,,,2,195--228,,,,,,"Renewed Investigation of the {{Ha}}'atuatua Dune ( {{Nukuhiva}}, {{Marquesas Islands}}): {{A}} Key Site in {{Polynesian}} Prehistory",,2018-05-15,104,1995
rolett1997,incollection,,"Rolett, Barry V. and Conte, Eric and Pearthree, Erik and Sinton, John",Prehistoric {{Long-Distance Interaction}} in {{Oceania}}: {{An Interdisciplinary Approach}},,,,,"Weisler, Marshall I.",,,,,,,,,,"Commerce,Oceania,Prehistoric,Social Science / Anthropology / General",english,,,,134--148,,New Zealand Archaeological Association,,,,Marquesan Voyaging: {{Archaeometric}} Evidence for Inter-Island Contact,,,,1997
rolett1998,book,,"Rolett, Barry Vladimir",,,,,,,,,1wVWjwEACAAJ,rolett1998a,,978-0-09-135161-8,,,,,english,,,,,,"{Department of Anthropology and The Peabody Museum, Yale University}",,,Hanamiai,"Hanamiai: {{Prehistoric Colonization}} and {{Cultural Change}} in the {{Marquesas Islands}}, {{East Polynesia}}",,,,1998
rolett2015,article,,"Rolett, Barry V. and West, Eric W. and Sinton, John M. and Iovita, Radu",,,,10.1016/j.jas.2014.10.018,,,,,,,,,0305-4403,Journal of Archaeological Science,,"Adze quarries,East Polynesia,Exchange networks,X-ray fluorescence",,January,,,459--471,,,,,Ancient {{East Polynesian}} Voyaging Spheres,"Ancient {{East Polynesian}} Voyaging Spheres: {{New}} Evidence from the {{Vitaria Adze Quarry}} ({{Rurutu}}, {{Austral Islands}})",,2018-02-02,53,2015
rosendahl1969,techreport,Honolulu,"Rosendahl, Paul H.",,,,,,,,,,,"Department of Anthropology, University of Hawaii",,,,,,,,,,,,,,,,"An {{Archaeological Survey}} of {{Ouli Coastal Lands Between Hapuna Bay}} and {{Kaunaoa Bay}}, {{South Kohala}}, {{Hawaii}}",,,,1969
ross-sheppard2013,article,,"{Ross-Sheppard}, Callan and Sand, Christophe and Balenaivalu, Jone and Burley, David V.",,,,,,,,,,,,,1179-4712,Journal of Pacific Archaeology,,"Fiji,Kutau/Bao Obsidian,Lapita",english,August,,2,79--83,,,,,,Kutau/{{Bao Obsidian}} -- {{Extending}} Its {{Eastern Distribution}} into the {{Fijian Northeast}},,2021-05-18,4,2013
rozier1971,techreport,Honolulu,"Rozier, S.N.",,,,,,,,,,,"Department of Anthropology, BPBM",,,,,,,,,71-11,,,,,,,"Archaeological {{Excavations}} at {{Kamehameha III Road}}, {{North Kona}}, {{Island}} of {{Hawaii}}, {{Phase II}}",,,,1971
sand1998,article,,"Sand, Christophe",,,,,,,20706768,jstor,,,,,0032-4000,Journal of the Polynesian Society,20706768,,,,,1,7--33,,,,,,"Archaeological {{Report}} on {{Localities WKO013A}} and {{WKO013B}} at the {{Site}} of {{Lapita}} ({{Kon\'e}}, {{New Caledonia}})",,2019-10-16,107,1998
sand1999,article,,"Sand, Christophe",,,,10.2307/530516,,,530516,jstor,,,,,0093-4690,Journal of Field Archaeology,530516,,,,,3,307--323,,"[Maney Publishing, Trustees of Boston University]",,,The {{Beginning}} of {{Southern Melanesian Prehistory}},"The {{Beginning}} of {{Southern Melanesian Prehistory}}: {{The St Maurice-Vatcha Lapita Site}}, {{New Caledonia}}",,2023-06-23,26,1999
sand2000,article,,"Sand, Christophe and Sheppard, Peter J",,,,10.1016/S1251-8050(00)01411-7,,,,,,,,,1251-8050,Comptes Rendus de l'Acad\'emie des Sciences - Series IIA - Earth and Planetary Science,,"complexe culturel Lapita,echanges,exchange,Lapita Cultural Complex,New Caledonia,Nouvelle-Caledonie,obsidian,obsidienne,Pacifique sud,South Pacific,Talasea",,August,,3,235--243,,,,,Long Distance Prehistoric Obsidian Imports in {{New Caledonia}},Long Distance Prehistoric Obsidian Imports in {{New Caledonia}}: {{Characteristics}} and Meaning,,2019-10-12,331,2000
schilt1984,techreport,Honolulu,"Schilt, A.R.",,,,,,,,,,,"Department of Anthropology, BPBM",,,,,,,,,84-1,,,,,,,"Subsistence and Conflict in {{Kona}}, {{Hawai}}'i: {{An}} Archaeological Study of the {{Kuakini Highway Realignment Corridor}}",,,,1984
seelenfreund-hirsch1985,phdthesis,,"{Seelenfreund-Hirsch}, Andrea Claudia",,,,,,,,,,,,,,,,,english,December,,,,,,University of Otago,,,The Exploitation of {{Mayor Island}} Obsidian in Prehistoric {{New Zealand}},,2020-10-20,,1985
sewell1992,techreport,,"Sewell, B.",,,,,,,,,,,"Auckland Conservancy Historic Resource Series, 1. Department of Conservation.",,,,,,,,,,,,,,,,"Further Excavations at the {{Westfield}} Site ({{R11}}/898), {{Tamaki}}, {{Auckland}}",,,,1992
shaw2021,article,,"Shaw, Ben and Irwin, Geoff and Pengilley, Alana and Kelloway, Sarah",,,,10.1002/arco.5224,,,,,,,,,,Archaeology in Oceania,,,,,,,32--44,,,,,,"Village-Specific {{Kula}} Partnerships Revealed by Obsidian Sourcing on {{Tubetube Island}}, {{Papua New Guinea}}",,,56,2021
sheppard1997,incollection,,"Sheppard, Peter J. and Walter, Richard K. and Parker, Robin J.",Prehistoric {{Long-Distance Interaction}} in {{Oceania}}: {{An Interdisciplinary Approach}},,,,,"Weisler, Marshall I.",,,,,,,,,,"Commerce,Oceania,Prehistoric,Social Science / Anthropology / General",english,,Sheppard-1997-Cook,,85--110,,New Zealand Archaeological Association,,,,Basalt Sourcing and the Development of {{Cook Islands}} Exchange Systems,,,,1997
sheppard2001,inbook,"Auckland, New Zealand","Sheppard, Peter J. and Sand, Christophe and Parker, Robin",Australasian {{Connections}} and {{New Directions}}: {{Proceedings}} of the 7th {{Australasian Archaeometry Conference}},"Jones, Martin and Sheppard, Peter",,,,,,,,,,,,,,,,,,,,,University of Auckland,,,,Sourcing {{Walpole Island}}: {{Problems}} and {{Prospects}} in {{Pacific Adze Sourcing}},,,,2001
sheppard2010,article,,"Sheppard, Peter and Trichereau, Barbara and Milicich, Cristany",,,,10.1002/j.1834-4453.2010.tb00074.x,,,,,,,,,1834-4453,Archaeology in Oceania,,"geochemistry,Lapita,Obsidian,XRF",english,,,1,21--30,,,,,,Pacific Obsidian Sourcing by Portable {{XRF}},,2021-05-18,45,2010
shipton2019,article,,"Shipton, Ceri and O'Connor, Sue and Reepmeyer, Christian and Kealy, Shimona and Jankowski, Nathan",,,,10.1080/15564894.2019.1581306,,,,,,,,,1556-4894,The Journal of Island and Coastal Archaeology,,"fishing,islands,lithics,mobility,seafaring,Southeast Asia",,July,,0,1--22,,Routledge,,,,"Shell {{Adzes}}, {{Exotic Obsidian}}, and {{Inter-Island Voyaging}} in the {{Early}} and {{Middle Holocene}} of {{Wallacea}}",,2020-10-20,0,2019
simpson2018,article,,"Simpson, Dale F. and Dussubieux, Laure",,,,10.1016/j.jasrep.2018.01.038,,,,,,,,,2352409X,Journal of Archaeological Science: Reports,,,english,April,,,370--385,,,,,A Collapsed Narrative?,A Collapsed Narrative? {{Geochemistry}} and Spatial Distribution of Basalt Quarries and Fine--Grained Artifacts Reveal Communal Use of Stone on {{Rapa Nui}} ({{Easter Island}}),,2018-04-19,18,2018
simpson2018a,article,,"Simpson, Dale F. and Weisler, Marshall I. and St Pierre, Emma J. and Feng, Yuexing and Bolhar, Robert",,,,10.1002/arco.5132,,,,,,,,,07284896,Archaeology in Oceania,,,english,April,,1,15--27,,,,,The Archaeological Documentation and Geochemistry of the {{Rua Tokitoki}} Adze Quarry and the {{Poike}} Fine-Grain Basalt Source on {{Rapa Nui}} ({{Easter Island}}),The Archaeological Documentation and Geochemistry of the {{Rua Tokitoki}} Adze Quarry and the {{Poike}} Fine-Grain Basalt Source on {{Rapa Nui}} ({{Easter Island}}): {{Rua Tokitoki}} Quarry and {{Poike}} Basalt Source on {{Rapa Nui}},,2018-04-19,53,2018
sinoto1965,techreport,Honolulu,"Sinoto, Yosihiko H. and Kellum, Marimari",,,,,,,,,,,Bernice P. Bishop Museum,,,,,,,,,,,,,,,,"Preliminary {{Report}} on {{Excavations}} in the {{Marquesas Islands}}, {{French Polynesia}}. {{Unpublished}} Report",,,,1965
sinoto1970a,techreport,Honolulu,"Sinoto, Yosihiko H. and Kelly, Marion A.",,,,,,,,,,,"Department of Anthropology, BPBM",,,,,,,,,70-11,,,,,,,"Archaeological and {{Historical Survey}} of {{Pakini-nui}} and {{Pakini-iki Coastal Sites}}, {{Waiahukini}}, {{Kailikii}} and {{Hawea}}, {{Ka}}'u, {{Hawaii}}",,,,1970
sinoto1983,article,,"Sinoto, Yosihiko H.",,,,10.3406/jso.1983.2773,,,,,,,,,0300-953X,Journal de la Soci\'et\'e des oc\'eanistes,,,french,,,76,57--67,,,,,,{An analysis of Polynesian migrations based on the archaeological assessments},,2017-11-24,39,1983
sinton1997,incollection,,"Sinton, John and Sinoto, Yosihiko H.",Prehistoric {{Long-Distance Interaction}} in {{Oceania}}: {{An Interdisciplinary Approach}},,,,,"Weisler, Marshall I.",,,,,,,,,,"Commerce,Oceania,Prehistoric,Social Science / Anthropology / General",english,,,,194--204,,New Zealand Archaeological Association,,,,A Geochemical Database for {{Polynesian}} Adze Studies,,,,1997
sinton2015,article,,"Sinton, John M. and Sinoto, Yosihiko H.",,,,10.1016/j.jasrep.2015.09.019,,,,,,,,,2352-409X,Journal of Archaeological Science: Reports,,"Adze,Chemistry,Hawaii,Molokai",,December,,,401--408,,,,,,"Geochemical and Petrographic Evidence for Adze Production at {{Pu}}'u {{P\=apa}}'i, {{East Moloka}}'i, {{Hawai}}'i",,2026-07-01,4,2015
skinner1960,article,,"Skinner, Henry D.",,,,,,,20703829,jstor,,,,,0032-4000,Journal of the Polynesian Society,20703829,,,,,3,187--198,,,,,,"Excavations at {{Little Papanui}}, {{Otago Peninsula}}",,2019-09-23,69,1960
smith1993,techreport,,"Smith, Ian",,,,,,,,,,,N.Z. Historic Places Trust,,,,,,,,,,,,,,,,Preliminary {{Report}} on {{Excavations}} at {{Pleasant River Mouth}} ({{J43}}/1),,,,1993
soehren1964,techreport,Honolulu,"Soehren, Lloyd J.",,,,,,,,,,,"Department of Anthropology, BPBM",,,,,,,,,,,,,,,,"An {{Archaeological Survey}} of the {{Shores}} of {{Ouli}} and {{Kawaihae}}, {{South Kohala}}, {{Hawaii}}",,,,1964
specht1981,article,,"Specht, Jim",,,,,,,20705581,jstor,,,,,0032-4000,Journal of the Polynesian Society,20705581,,,,,3,337--356,,Polynesian Society,,,,"Obsidian Sources at {{Talasea}}, {{West New Britain}}, {{Papua New Guinea}}",,2021-01-15,90,1981
specht1981a,techreport,,"Specht, Jim and Hollis, J and Pain, C",,,,,,,,,,,,,,,,,,,,,,,,,,,"Report on {{Archaeological Fieldwork}}, {{West New Britain}}, {{Papua New Guinea}}. {{Report}} Submitted to the {{Provincial}} Government.",,,,1981
specht2007,article,,"Specht, Jim and Torrence, Robin",,,,,,,,,,,,,1835-4211 online,Technical Reports of the Australian Museum,,,english,,,,131--196,,,,,,"Pottery of the {{Talasea Area}}, {{West New Britain Province}}",,,20,2007
spriggs2010,article,,"Spriggs, Matthew and Bird, Roger and Ambrose, Wal",,,,10.1002/j.1834-4453.2010.tb00075.x,,,20743943,jstor,,,,,0728-4896,Archaeology in Oceania,20743943,,,,,1,31--38,,"[Wiley, Oceania Publications, University of Sydney]",,,,A Reanalysis of the {{Tikopia}} Obsidians,,2021-04-20,45,2010
spriggs2011,article,,"Spriggs, Matthew and Reepmeyer, Christian and {Anggraeni} and Lape, Peter and Neri, Leee and Ronquillo, Wilfredo P. and Simanjuntak, Truman and Summerhayes, Glenn and Tanudirjo, Daud and Tiauzon, Archie",,,,10.1016/j.jas.2011.06.015,,,,,,,,,0305-4403,Journal of Archaeological Science,,"Island southeast Asia,Obsidian,Sourcing",english,November,,11,2873--2881,,,,,Obsidian Sources and Distribution Systems in {{Island Southeast Asia}},Obsidian Sources and Distribution Systems in {{Island Southeast Asia}}: A Review of Previous Research,,2021-03-30,38,2011
stevenson1984,article,,"Stevenson, Christopher M. and Shaw, Leslie C. and Cristino, C.",,,,,,,,,,,,,,Archaeology in Oceania,,,english,,,3,120--124,,,,,,Obsidian {{Procurement}} and {{Consumption}} on {{Easter Island}},,2019-03-18,19,1984
stevenson2013,article,,"Stevenson, Christopher M. and Ladefoged, Thegn N. and Haoa, Sonia and Chadwick, Oliver and Puleston, Cedric",,,,10.1080/15564894.2012.745457,,,,,,,,,1556-4894,The Journal of Island and Coastal Archaeology,,"exchange,obsidian,procurement,Rapa Nui,x-ray fluorescence",,January,,1,108--121,,,,,,Prehistoric {{Obsidian Exchange}} on {{Rapa Nui}},,2019-03-18,8,2013
suggs1961,book,,"Suggs, Robert C.",,,,,,,,,,,,,,,,,,,,49,,,,,Anthropological {{Papers}} of the {{American Museum}} of {{Natural History}},,"The {{Archaeology}} of {{Nuku Hiva}}, {{Marquesas Islands}}, {{French Polynesia}}",,,,1961
sutton2003,book,,"Sutton, Douglas and Furey, Louise and Marshall, Yvonne",,,,,,,,,,,,978-1-86940-292-1,,,,,,,,,,,Auckland University Press,,,,The {{Archaeology}} of {{Pouerua}},,2019-09-21,,2003
terrell2011,article,,"Terrell, John Edward",,,,10.3158/0071-4739-42.1.251,,,,,,,,,,Fieldiana Anthropology,,,,,,,69--86,,,,,,Archaeological {{Excavations}} ({{Exploring Prehistory}} on the {{Sepik Coast}} of {{Papua New Guinea}}),,,42,2011
terrell2011a,article,,"Terrell, John Edward",,,,10.3158/0071-4739-42.1.251,,,,,,,,,,Fieldiana Anthropology,,,,,,,35--68,,,,,,Archaeological {{Surveys}} ({{Exploring Prehistory}} on the {{Sepik Coast}} of {{Papua New Guinea}}),,,42,2011
teviotdale1932,article,,"Teviotdale, David",,,,,,,20702411,jstor,,teviotdale1932a,,,0032-4000,Journal of the Polynesian Society,20702411,,,,,2(162),81--120,,,,,,The Material Culture of the {{Moa-Hunters}} in {{Murihiku}},,2019-09-26,41,1932
toenjes1986,techreport,Honolulu,"Toenjes, J.H.",,,,,,,,,,,"Department of Anthropology, BPBM",,,,,,,,,,,,,,,,"Archaeological Monitoring in the {{Kuakini Highway}} Realignment, {{Kona}}, {{Hawaii}}",,,,1986
torrence1992,article,,"Torrence, Robin and Specht, Jim and Fullagar, Richard and Bird, R.",,,,10.3853/j.0812-7387.15.1992.86,,,,,,,,,0812-7387,"Records of the Australian Museum, Supplement",,,english,,,,83--98,,,,,,"From {{Pleistocene}} to {{Present}}: {{Obsidian}} Sources in West {{New Britain}}, {{Papua New Guinea}}",,,15,1992
torrence2002,article,,"Torrence, Robin",,,,10.1017/S0003598X00091213,,,,,,,,,"0003-598X, 1745-1744",Antiquity,,"landscape archaeology,Lapita pottery,obsidian,Pacific archaeology,Papua New Guinea",english,September,,293,766--776,,Cambridge University Press,,,,"Cultural Landscapes on {{Garua Island}}, {{Papua New Guinea}}",,2021-01-22,76,2002
torrence2007,inbook,New York,"Torrence, Robin and Doelman, Trudy",Living {{Under}} the {{Shadow}} : {{Cultural Impacts}} of {{Volcanic Eruptions}},"Grattan, John and Torrence, Robin",,10.4324/9781315425177,,,,,,,,978-1-315-42517-7,,,,,english,,,,42--66,,Routledge,,,,"Chaos and {{Selection}} in {{Catastrophic Environments}}: {{Willaumez Peninsula}}, {{Papua New Guinea}}",,2021-01-22,,2007
tuggle1980,article,,"Tuggle, H. David and {Tomonari-Tuggle}, M. J.",,,,10.2307/529593,,,529593,jstor,,,,,0093-4690,Journal of Field Archaeology,529593,,,,,3,297--312,,,,,,"Prehistoric {{Agriculture}} in {{Kohala}}, {{Hawaii}}",,2018-02-21,7,1980
turner1994,article,,"Turner, Marianne and Bonica, Dante",,,,,,,,,,,,,,New Zealand Journal of Archaeology,,,,,,,5--32,,,,,,"Following the {{Flake Trail}}: {{Adze}} Production on the {{Coromandel East Coast}}, {{New Zealand}}",,,16,1994
tykot1996,article,,"Tykot, Robert H. and Chia, Stephen",,,,10.1557/PROC-462-175,,,,,,,,,"0272-9172, 1946-4274",Materials Research Society Symposium Proceedings,,,english,,,,175--180,,,,,,Long-{{Distance Obsidian Trade}} in {{Indonesia}},,2020-02-23,462,1996
valentin2013,article,,"Valentin, Frederique and Clark, Geoffrey",,,,,,,,,,,,,1179-4712,Journal of Pacific Archaeology,,"Ancestral Polynesian Society,cremation,Lapita,mortuary practice,Pacific Islands",english,January,,1,1--14,,,,,,"Early {{Polynesian}} Mortuary Behaviour at the {{Talasiu}} Site, {{Kingdom}} of {{Tonga}}",,2019-10-24,4,2013
walter1990,phdthesis,,"Walter, Richard",,,,,,,,,,,,,,,,,,,,,,,,University of Auckland,,,The {{Southern Cook Islands}} in {{Eastern Polynesian}} Prehistory,,,,1990
walter1996a,article,,"Walter, Richard and Sheppard, Peter J.",,,,10.1002/j.1834-4453.1996.tb00344.x,,,,,,,,,1834-4453,Archaeology in Oceania,,,english,April,,1,33--39,,,,,The {{Ngati Tiare Adze Cache}},The {{Ngati Tiare Adze Cache}}: {{Further}} Evidence of Prehistoric Contact between {{West Polynesia}} and the {{Southern Cook Islands}},,2018-01-30,31,1996
walter1998,book,Auckland,"Walter, Richard",,,,,New Zealand Archaeological Association Monograph 22,,,,,,,978-0-9597915-5-6,,,,,english,,,22,,,New Zealand Archaeological Association,,,Anai'o,Anai'o: {{The Archaeology}} of a {{Fourteenth Century Polynesian Community}} in the {{Cook Islands}},,,,1998
